{
  "page": "Capa LOB Summary",
  "version": "lob@2026-10-22",
  "viewport": {"width": 1440, "height": 900, "scale": 2},
  "mask": ["named:SIDEBAR_FOOTER"],
  "params": {
    "edit_process": {"type": "text", "default": "Pre B/D", "about": "기준 정보 › 설비대수 › 가용 표에서 고칠 행의 공정 이름(「공정」 열 글자)"},
    "edit_month": {"type": "text", "default": "202612", "about": "고칠 달 — 가용 표의 달 열 머리(YYYYMM). 사이드바 조회기간 안이어야 한다"},
    "edit_delta": {"type": "int", "default": 2, "about": "그 칸에 더할 대수"},
    "revision_name": {"type": "text", "default": "12월 Pre B/D 가용 +2", "about": "저장 팝업 「새 리비전명」에 적을 글"},
    "revision_memo": {"type": "text", "default": "반입 일정 앞당김 반영", "about": "저장 팝업 「변경 메모」에 적을 글"},
    "official_scenario": {"type": "text", "default": "26년 10월 정기 Capa 검토", "about": "시나리오 관리 목록에서 「선택」을 체크할 시나리오 이름(보통 활성 시나리오)"},
    "official_name": {"type": "text", "default": "10월 공식안(12월 가용 반영)", "about": "공식 지정 폼 「공식버전명」에 적을 글(미리 채운 값을 지우고 쓴다)"},
    "official_memo": {"type": "text", "default": "12월 Pre B/D 가용 +2 반영", "about": "공식 지정 폼 「공식 지정 메모」에 적을 글"},
    "compare_scenario": {
      "type": "text",
      "default": "26년 9월 정기 Capa 검토",
      "about": "Preference 「비교 시나리오」에서 고를 시나리오 이름(앞부분만 적어도 첫 일치를 고른다)"
    }
  },
  "states": [
    {
      "id": "01_home_main",
      "page": "HOME",
      "note": "HOME · Main 탭 첫 화면(최신 공식)",
      "writes": "none",
      "ops": [{"op": "enter_app"}],
      "targets": {
        "sidebar_scenario": "named:SIDEBAR_SCEN",
        "sidebar_badge": "named:SIDEBAR_BADGE",
        "sidebar_period": "key:condition_field_period",
        "sidebar_procfilter": "key:condition_field_process_filter",
        "sidebar_lobcond": "key:condition_card_home",
        "sidebar_heatmap": "key:condition_field_key_process",
        "guide_btn": "button:Guide",
        "header_band": "named:HEADER_BAND",
        "tab_main": "tab:Main",
        "tab_pref": "tab:Preference",
        "tab_past": "tab:Past Data",
        "lob_chart": "named:LOB_CHART",
        "lob_density": "named:LOB_LABEL(Density)",
        "lob_wafer_plan": "named:LOB_LABEL(Wafer 계획)",
        "lob_wafer_capa": "named:LOB_LABEL(Wafer Capa)",
        "bn_top5": "named:LOB_LABEL(B/N Top 5)",
        "bn_top5_row": "named:LOB_ROW(B/N Top 5)",
        "lob_bn_bar": "named:LOB_ROW(생산계획 LOB)",
        "lob_bn_bars": "named:LOB_BN_BARS",
        "nav_home": "nav:HOME",
        "nav_scenario_mgmt": "nav:시나리오 관리",
        "nav_static_box": "key:static_capa_box"
      }
    },
    {
      "id": "02_home_lower",
      "page": "HOME",
      "note": "HOME 아래 — 주요공정 확보율 · 상세 B/N 공정",
      "from": "01_home_main",
      "writes": "none",
      "ops": [{"op": "scroll", "target": "key:bottleneck_detail_labels", "block": "end"}],
      "targets": {"key_process_grid": "named:KEY_PROCESS_GRID", "detail_bn": "named:DETAIL_BN", "bn_cell": "named:BN_CELL"}
    },
    {
      "id": "03_process_detail",
      "page": "공정 Capa 상세",
      "note": "상세 B/N 칸을 눌러 연 공정 Capa 상세",
      "from": "02_home_lower",
      "writes": "none",
      "ops": [{"op": "click", "target": "named:BN_CELL"}],
      "targets": {
        "page_title": "named:PAGE_TITLE",
        "proc_card": "named:PROC_HEAD",
        "kpi_cards": "key:process_detail_kpis",
        "month_canvas": "named:PROC_MONTH_CANVAS",
        "back_home": "named:MAIN_LINK(HOME)",
        "sidebar_proc_card": "key:condition_card_process_capa_detail"
      }
    },
    {
      "id": "03b_process_detail_lower",
      "page": "공정 Capa 상세",
      "note": "공정 Capa 상세 아래 — 산출 근거와 「경로별 인자」",
      "from": "03_process_detail",
      "writes": "none",
      "ops": [{"op": "scroll", "target": "key:process_detail_evidence", "block": "end", "offset": 24}],
      "targets": {
        "evidence": "key:process_detail_evidence",
        "path_factors": "key:process_detail_route_factors",
        "month_prev": "key:process_detail_previous_month",
        "month_next": "key:process_detail_next_month"
      }
    },
    {
      "id": "04_procfilter_open",
      "page": "HOME",
      "note": "사이드바 「공정 필터」 팝업",
      "from": "01_home_main",
      "writes": "none",
      "ops": [{"op": "open_popup", "target": "key:dashboard_bottleneck_process_dialog_open"}],
      "targets": {
        "pf_dialog": "named:DIALOG",
        "pf_tiles": "named:PF_TILES",
        "pf_all_on": "button:전체 ON",
        "pf_apply": "button:선택 공정 적용"
      }
    },
    {
      "id": "05_lobcond_open",
      "page": "HOME",
      "note": "사이드바 「LOB 표시 조건」 펼침",
      "from": "01_home_main",
      "writes": "none",
      "ops": [{"op": "click", "target": "named:EXPANDER(condition_card_home)"}],
      "targets": {
        "lc_card": "named:EXPANDER(condition_card_home)",
        "lc_gap": "key:home_show_comparison",
        "lc_advance": "key:home_show_advance",
        "lc_correction": "key:home_show_execution"
      }
    },
    {
      "id": "06_home_pref",
      "page": "HOME",
      "note": "HOME · Preference 탭 — 확보율 판정 기준 · 비교 시나리오",
      "from": "01_home_main",
      "writes": "none",
      "ops": [
        {"op": "tab", "text": "Preference"},
        {"op": "scroll", "target": "named:HEAD_BOX(비교 시나리오)", "block": "start", "offset": -76}
      ],
      "targets": {
        "pref_criteria_box": "named:HEAD_BOX(확보율 판정 기준)",
        "pref_criteria_inputs": ["named:WIDGET(기본 확보 기준(%))", "named:WIDGET(기본 경고 기준(%))"],
        "pref_criteria_save": "button:판정 기준 저장",
        "pref_compare_box": "named:HEAD_BOX(비교 시나리오)",
        "pref_compare_scenario": "named:WIDGET(비교 시나리오)"
      }
    },
    {
      "id": "07_sidebar_static_open",
      "page": "HOME",
      "note": "사이드바 「Static Capa」 묶음 펼침",
      "from": "01_home_main",
      "writes": "none",
      "ops": [{"op": "click", "target": "named:EXPANDER(static_capa_box)"}],
      "targets": {
        "nav_static_box": "named:EXPANDER(static_capa_box)",
        "nav_reference": "nav:기준 정보",
        "nav_loadconv": "nav:생산 계획",
        "nav_static_summary": "nav:현황 요약"
      }
    },
    {
      "id": "12_loadconv_pkgplan",
      "page": "생산 계획",
      "note": "생산 계획 · PKG PLAN 탭(편집 없음)",
      "from": "07_sidebar_static_open",
      "writes": "none",
      "ops": [{"op": "nav", "text": "생산 계획"}, {"op": "tab", "text": "PKG PLAN"}],
      "targets": {
        "tab_pkgplan": "tab:PKG PLAN",
        "tab_convert": "tab:환산",
        "tab_yield": "tab:수율",
        "pkg_table": "named:GRID",
        "pkg_apply": "button:PKG PLAN 변경사항 적용",
        "pkg_paste": "button:Excel 붙여넣기",
        "pkg_virtual": "button:가상 제품 등록"
      }
    },
    {
      "id": "08_ref_avail",
      "page": "기준 정보",
      "note": "기준 정보 · 설비대수 · 가용",
      "from": "07_sidebar_static_open",
      "writes": "none",
      "ops": [{"op": "nav", "text": "기준 정보"}, {"op": "tab", "text": "설비대수"}, {"op": "tab", "text": "가용"}],
      "targets": {
        "tab_eqp": "tab:설비대수",
        "subtab_avail": "tab:가용",
        "subtab_own": "tab:보유",
        "ref_table": "named:GRID",
        "ref_apply": "button:변경사항 적용",
        "ref_paste": "button:Excel 붙여넣기"
      }
    },
    {
      "id": "09_ref_edited",
      "page": "기준 정보",
      "note": "가용 표의 한 칸을 고친 직후(적용 전)",
      "from": "08_ref_avail",
      "writes": "session",
      "ops": [
        {
          "op": "grid_edit",
          "grid": "named:GRID",
          "row": {"param": "edit_process", "default": "Pre B/D"},
          "row_column": "공정",
          "column": {"param": "edit_month", "default": "202612"},
          "delta": {"param": "edit_delta", "default": 2}
        },
        {"op": "key", "key": "Escape"}
      ],
      "targets": {
        "ref_change_notice": "text:변경사항 확인",
        "ref_tab_dot": "tab:가용",
        "ref_tab_dot_parent": "tab:설비대수",
        "ref_apply": "button:변경사항 적용",
        "ref_cancel": "button:편집 취소",
        "ref_edited_cell": "named:EDIT_CELL",
        "sidebar_pending_notice": "named:SIDEBAR_PENDING",
        "ref_table": "named:GRID"
      }
    },
    {
      "id": "10_ref_applied",
      "page": "기준 정보",
      "note": "「변경사항 적용」 뒤 — 성공 알림 · 사이드바 「미저장 변경」",
      "from": "09_ref_edited",
      "writes": "session",
      "ops": [{"op": "click", "target": "button:변경사항 적용"}],
      "targets": {
        "ref_success": "named:MAIN_ALERT(활성 시나리오에 적용했습니다)",
        "sidebar_scenario": "named:SIDEBAR_SCEN",
        "sidebar_badge": "named:SIDEBAR_BADGE",
        "header_band": "named:HEADER_BAND",
        "ref_tab_dot": "tab:가용"
      }
    },
    {
      "id": "11_home_after_apply",
      "page": "HOME",
      "note": "적용 뒤 HOME · Main — 머리 띠와 사이드바가 미저장 변경을 단다",
      "from": "10_ref_applied",
      "writes": "none",
      "ops": [{"op": "nav", "text": "HOME"}, {"op": "tab", "text": "Main"}, {"op": "scroll", "to": "top"}],
      "targets": {
        "sidebar_scenario": "named:SIDEBAR_SCEN",
        "sidebar_badge": "named:SIDEBAR_BADGE",
        "header_band": "named:HEADER_BAND",
        "lob_chart": "named:LOB_CHART"
      }
    },
    {
      "id": "13_scenario_popup_save",
      "page": "시나리오·리비전 팝업",
      "note": "사이드바 시나리오 칸 → 「새 리비전 저장」 구획, 이름 · 메모 입력(저장은 누르지 않는다)",
      "from": "11_home_after_apply",
      "writes": "none",
      "ops": [
        {"op": "open_popup", "target": "named:SIDEBAR_SCEN", "section": "새 리비전 저장"},
        {"op": "fill", "label": "새 리비전명", "value": {"param": "revision_name", "default": "12월 Pre B/D 가용 +2"}},
        {"op": "fill", "label": "변경 메모", "value": {"param": "revision_memo", "default": "반입 일정 앞당김 반영"}}
      ],
      "targets": {
        "popup": "named:DIALOG",
        "popup_sections": "named:DIALOG_SECTIONS",
        "popup_name": "named:WIDGET(새 리비전명)",
        "popup_memo": "named:WIDGET(변경 메모)",
        "popup_save": "button:신규 리비전 저장"
      }
    },
    {
      "id": "14_scenario_saved",
      "page": "HOME",
      "note": "신규 리비전 저장 뒤 — 팝업이 닫히고 사이드바에 저장 알림 · 「저장된 리비전」",
      "from": "13_scenario_popup_save",
      "writes": "db",
      "ops": [{"op": "click", "target": "button:신규 리비전 저장"}],
      "targets": {